{
  "$schema": "../../governance/proposal-review.schema.json",
  "artifactType": "baseballo-semantic-proposal-review",
  "schemaVersion": 1,
  "proposalId": "mlb-game-strikeout-double-play",
  "title": "K1 existing compound double-play result for five strikeout double plays",
  "status": "under-review",
  "proposedIris": [],
  "artifacts": {
    "competencyQuestions": [
      {
        "path": "README.md",
        "sha256": "528ae545ec9f5eccadc98296d316c2cfae9d9f8048978df7b0f85474ebd6dc0f"
      }
    ],
    "sourceEvidence": [
      {
        "path": "README.md",
        "sha256": "528ae545ec9f5eccadc98296d316c2cfae9d9f8048978df7b0f85474ebd6dc0f"
      }
    ],
    "fieldSelectionInventory": [
      {
        "path": "README.md",
        "sha256": "528ae545ec9f5eccadc98296d316c2cfae9d9f8048978df7b0f85474ebd6dc0f"
      }
    ],
    "sourceIndependentMermaid": [
      {
        "path": "source-independent-mermaid.md",
        "sha256": "72adeee4d57c3afe50b7a6c90495ce23f4bca6203f9aafde2ac1306bb0b38fd9"
      }
    ]
  },
  "ontologistDecision": null
}
