{
  "$schema": "../../../governance/proposal-review.schema.json",
  "artifactType": "baseballo-semantic-proposal-review",
  "schemaVersion": 1,
  "proposalId": "mlb-game-metric-mapping-completion",
  "title": "M1 counted-foul coverage and M2 affirmed pitch-review mapping",
  "status": "accepted",
  "proposedIris": [],
  "artifacts": {
    "competencyQuestions": [
      {
        "path": "README.md",
        "sha256": "7fc3842c80e0858fa19c9b246a8ad9c8f83cc1e31e3fa6078867ea9c7c466cfc"
      },
      {
        "path": "mapping-contract.md",
        "sha256": "e40a8a07779d69c0fb3597686a2831c1e539dd5807a70d16eaab1d146239af04"
      },
      {
        "path": "user-decision.md",
        "sha256": "99d072030e6ad394ab1344b6e1a24f233f970f55aeb9a4cdd40d2f07b7d7a63c"
      }
    ],
    "sourceEvidence": [
      {
        "path": "source-evidence.md",
        "sha256": "c87e734eda466ed73df03825a51561a5b06e4642a5b1ec7209bc7d5a5f833734"
      },
      {
        "path": "source-capture.json",
        "sha256": "3047cf27c10ab2feb8598acac511f2791f7c0b3983c39eba40d49407076ee89e"
      }
    ],
    "fieldSelectionInventory": [
      {
        "path": "field-selection-inventory.md",
        "sha256": "474fb3f5884a3954b7de9fefc3937b1ecc0314f049bc71f6c17a9fdb79ee9f49"
      }
    ],
    "sourceIndependentMermaid": [
      {
        "path": "source-independent-mermaid.md",
        "sha256": "3dddb38bd68490b39571441bcca644fca00d6d9558cc5bf610c2dcdf30197a30"
      },
      {
        "path": "source-specific-mermaid.md",
        "sha256": "10425813e0dde2a3a09fcd7cfc9951ce3a2177a70cda10c354d74c71e073d427"
      }
    ]
  },
  "ontologistDecision": {
    "disposition": "accepted",
    "decidedBy": "Carter Beau Benson",
    "decidedAt": "2026-09-15",
    "rationale": "Explicit Approve to named M1 and M2, including operative review judgment identity, source-specific design, validation and module pin updates; no new ontology vocabulary or global ratification.",
    "authorizedArtifacts": [
      "Baseball/scripts/pipeline/prepare-rml-context.py",
      "Baseball/sources/mlb-game/mapping/mlb-game.rml.ttl",
      "Baseball/sources/mlb-game/mapping/iri-policy.yaml",
      "Baseball/sources/mlb-game/mapping/mapping-coverage.yaml",
      "Baseball/sources/mlb-game/mapping/ontology-coverage-gaps.yaml",
      "Baseball/sources/mlb-game/shacl/authoritative.ttl",
      "Baseball/sources/mlb-game/review/semantic-status.json",
      "Baseball/sources/mlb-game/review/rml-mermaid-manifest.json"
    ]
  }
}
